Titel,KRNr.,VorlagenNr.,Geschaeftsart,Datum,Direktion,Kommission,Pendent bei,Direktlink,
,,,,,,,,,
Wahl Mitglied der Kommission für Justiz und öffentliche Sicherheit,1/2019,,Wahl,07.01.2019,,,,https://kantonsrat-zh.talus.ch/de/politik/cdws/geschaefte.php?id=c70b29b065ca42bf85c660ac4e0487e3,
Keine Ladenöffnung am Berchtoldstag,6/2019,,Motion,14.01.2019,Volkswirtschaftsdirektion,,,https://kantonsrat-zh.talus.ch/de/politik/cdws/geschaefte.php?id=5fc4679b6e0f427394361460888f7fc8,
Standesinitiative ? Marschhalt beim E-Voting,2/2019,,Parlamentarische Initiative,07.01.2019,,,,https://kantonsrat-zh.talus.ch/de/politik/cdws/geschaefte.php?id=e364091da22e480095fb03960545d4d3,
Wahl Ersatzmitglied Obergericht,4/2019,,,14.01.2019,,Interfraktionelle Konferenz,,https://kantonsrat-zh.talus.ch/de/politik/cdws/geschaefte.php?id=4e7cb424372b4d52bf7d8e5cf321b9c2,
"Einführung e-Collecting, elektronische Unterschriftensammlung für Initiativen und Referenden im Internet oder auf mobilen Endgeräten",5/2019,,Motion,14.01.2019,Direktion der Justiz und des Innern,,,https://kantonsrat-zh.talus.ch/de/politik/cdws/geschaefte.php?id=7ea3ad7713194104a4428b8a7cf85264,
Umweltbericht: Reduktion der Ammoniakemissionen,7/2019,,Postulat,14.01.2019,,,,https://kantonsrat-zh.talus.ch/de/politik/cdws/geschaefte.php?id=ffb9f3fafd3f4d508092a6361c2685f1,
Umweltbericht: CO2-Rückgewinnung im Kanton Zürich,8/2019,,Postulat,14.01.2019,,,,https://kantonsrat-zh.talus.ch/de/politik/cdws/geschaefte.php?id=ab931d59378e4654a143a59eef1c7f69,
Umweltbericht: Bericht Veloinfrastruktur verbessern und Veloverkehrsanteil erhöhen,9/2019,,Postulat,14.01.2019,Volkswirtschaftsdirektion,,,https://kantonsrat-zh.talus.ch/de/politik/cdws/geschaefte.php?id=b2b77c5e36e740e9b675bf851dda3dca,
Umweltbericht: Mehr Qualität in den Schutzgebieten,10/2019,,Postulat,14.01.2019,,,,https://kantonsrat-zh.talus.ch/de/politik/cdws/geschaefte.php?id=e7fd665f918444afa51f8daace1c3357,
Vom Schlusslicht in die Spitzengruppe,11/2019,,Postulat,14.01.2019,Bildungsdirektion,,,https://kantonsrat-zh.talus.ch/de/politik/cdws/geschaefte.php?id=1e64a398ddf94216bfe931da1c161c1f,
Keine Speicherpflicht für Pelletheizungen bis 70 kW,12/2019,,Postulat,14.01.2019,,,,https://kantonsrat-zh.talus.ch/de/politik/cdws/geschaefte.php?id=b576e53e471942e6a134b1818672c484,
Für die Aufhebung des Kantonsratsbeschlusses vom 22. Oktober 2012 für die Bewilligung eines Verpflichtungskredites von 21 Millionen Franken für die Strasse «Uster West»,32/2019,,Einzelinitiative,07.01.2019,,,,https://kantonsrat-zh.talus.ch/de/politik/cdws/geschaefte.php?id=b387d96d61b344e9b59a4ac3895cc1b0,
Rechnung und Geschäftsbericht der Elektrizitätswerke des Kantons Zürich für das Geschäftsjahr 2017/18,40/2019,,,29.01.2019,Verwaltungsrat Elektrizitätswerke des Kantons Zürich,Aufsichtskommission über die wirtschaftlichen Unternehmen,,https://kantonsrat-zh.talus.ch/de/politik/cdws/geschaefte.php?id=085fa14868544501ab0abe3ee699b828,
Zusammenarbeit der Gemeinden im Gesundheitsbereich verbessern,33/2019,,Motion,28.01.2019,Direktion der Justiz und des Innern,,,https://kantonsrat-zh.talus.ch/de/politik/cdws/geschaefte.php?id=2537d6710e2b4a1b95c3b1efc40b4ebf,
Übersetzung in die Gebärdensprache,34/2019,,Postulat,28.01.2019,Staatskanzlei,,,https://kantonsrat-zh.talus.ch/de/politik/cdws/geschaefte.php?id=33f6ce0949194f999537ec51ed9b1306,
Schnellspur für voll besetzte Autos,35/2019,,Postulat,28.01.2019,Volkswirtschaftsdirektion,,,https://kantonsrat-zh.talus.ch/de/politik/cdws/geschaefte.php?id=bc33dd134b0e428e9dfff9531c64d0c7,
Pilotversuche mit Cannabis II,36/2019,,Anfrage,28.01.2019,Gesundheitsdirektion,,,https://kantonsrat-zh.talus.ch/de/politik/cdws/geschaefte.php?id=f282efad684f407e9fd56272c98c17b2,
Sanktionsmöglichkeiten der Sozialbehörde,37/2019,,Anfrage,28.01.2019,Sicherheitsdirektion,,,https://kantonsrat-zh.talus.ch/de/politik/cdws/geschaefte.php?id=6f3b9bb19afa499aa1f95aa67fc32f64,
Die Universität Zürich und die Spin-offs,38/2019,,Anfrage,28.01.2019,Bildungsdirektion,,,https://kantonsrat-zh.talus.ch/de/politik/cdws/geschaefte.php?id=f60f0729bcaa45f7a332db4edac9dfb0,
Verkehrsbehinderung durch Fahrbahnhaltestellen,39/2019,,Anfrage,28.01.2019,Volkswirtschaftsdirektion,,,https://kantonsrat-zh.talus.ch/de/politik/cdws/geschaefte.php?id=6f89625705404a9e9cde381651c125e9,
Wahl zwei Mitglieder Handelsgericht,41/2019,,Wahl,29.01.2019,,,,https://kantonsrat-zh.talus.ch/de/politik/cdws/geschaefte.php?id=699718bbee3542d48b80a44d0d7c014c,
Frühe Deutschförderung,42/2019,,Motion,04.02.2019,Bildungsdirektion,,,https://kantonsrat-zh.talus.ch/de/politik/cdws/geschaefte.php?id=dfd68020f4c9499d9032d9b8c1cd5eb0,
Gleich lange Spiesse für staatsnahe Betriebe bei kantonalen Beschaffungen,43/2019,,Motion,04.02.2019,Baudirektion,,,https://kantonsrat-zh.talus.ch/de/politik/cdws/geschaefte.php?id=f359708a42db4feeafe8459efec79fb1,
Individuelle Prämienverbilligungen: Die Regierung muss handeln,44/2019,,Dringliches Postulat,04.02.2019,Gesundheitsdirektion,,,https://kantonsrat-zh.talus.ch/de/politik/cdws/geschaefte.php?id=cf8b260631cb4a1d9a22bdc0889649b7,
Selbstfahrende Autos als Teil des öffentlichen Verkehrs,46/2019,,Postulat,04.02.2019,Volkswirtschaftsdirektion,,,https://kantonsrat-zh.talus.ch/de/politik/cdws/geschaefte.php?id=6b7d76abf5814168a6046c0b58c55d64,
Zukünftige Verkehrsgestaltung mit innovativen Mobilitätsformen,47/2019,,Postulat,04.02.2019,Volkswirtschaftsdirektion,,,https://kantonsrat-zh.talus.ch/de/politik/cdws/geschaefte.php?id=299e27bae0b3476a856b054d7a3e241d,
Prämienverbilligung: Klare Worte des Bundesgerichts,49/2019,,Dringliche Anfrage,04.02.2019,Gesundheitsdirektion,,,https://kantonsrat-zh.talus.ch/de/politik/cdws/geschaefte.php?id=a63455f57bcd4403a24328852b03588c,
Gleiche Messlatte für Deutschkompetenz,50/2019,,Anfrage,04.02.2019,Volkswirtschaftsdirektion,,,https://kantonsrat-zh.talus.ch/de/politik/cdws/geschaefte.php?id=d83e9148d16c458aa7b2aa8b40dfa31d,
Überlastete Kantonsstrassen im Oberland,51/2019,,Anfrage,04.02.2019,Volkswirtschaftsdirektion,,,https://kantonsrat-zh.talus.ch/de/politik/cdws/geschaefte.php?id=79490b26ab124811b6200ade6ec61f3c,
Rituelle Gewalt,52/2019,,Anfrage,04.02.2019,Direktion der Justiz und des Innern,,,https://kantonsrat-zh.talus.ch/de/politik/cdws/geschaefte.php?id=e4b86395a52a4653b6f4f0741f0f3c9f,
Wahl Mitglied GPK für den ausgetretenen Stephan Weber,59/2020,,Wahl,18.02.2019,,Interfraktionelle Konferenz,Kantonsrat ,https://kantonsrat-zh.talus.ch/de/politik/cdws/geschaefte.php?id=6b531cb12f734910b5b271767facb403,
"Zusammensetzung der Gruppe, die den Sozialhilfegesetz-Entwurf vorgelegt hat",57/2019,,Interpellation,11.02.2019,Sicherheitsdirektion,,,https://kantonsrat-zh.talus.ch/de/politik/cdws/geschaefte.php?id=71a247e99c9c439d854444c4a9c81b76,
Kickbackzahlungen an Ärzte,58/2019,,Anfrage,11.02.2019,,,,https://kantonsrat-zh.talus.ch/de/politik/cdws/geschaefte.php?id=53d9bad3238e452fa64f841c280a17d8,
"Sanierung Wanne Pumpwerk, Winterthurerstrasse, 8340 Hinwil",70/2019,,Anfrage,25.02.2019,Baudirektion,,,https://kantonsrat-zh.talus.ch/de/politik/cdws/geschaefte.php?id=a6679bd53ded46d082528f53957947dc,
Eigentümerstrategie im Falle von Beteiligungen des Kantons Zürich,71/2019,,Anfrage,25.02.2019,Staatskanzlei,,,https://kantonsrat-zh.talus.ch/de/politik/cdws/geschaefte.php?id=18cf6c955f734b93b0144b053664d105,
Ausbildung von Ärztinnen und Ärzten: Kapazitätslücke bei den Universitätsabschlüssen in Humanmedizin,72/2019,,Anfrage,25.02.2019,Bildungsdirektion,,,https://kantonsrat-zh.talus.ch/de/politik/cdws/geschaefte.php?id=d81dac5640f445bd96f7eac543c2ba65,
Staatsgarantie der Zürcher Kantonalbank,69/2019,,Parlamentarische Initiative,25.02.2019,,,Erledigt Kantonsrat ,https://kantonsrat-zh.talus.ch/de/politik/cdws/geschaefte.php?id=1bdd21a847bc43ec87e0264042ad3597,
Ökologische Kleinwohnformen fördern statt verhindern,66/2019,,Postulat,25.02.2019,Baudirektion,,,https://kantonsrat-zh.talus.ch/de/politik/cdws/geschaefte.php?id=c586d89d5d79475285971dff82d3fe38,
Synergien beim Software-Einsatz im Kanton Zürich nutzen,65/2019,,Postulat,25.02.2019,Finanzdirektion,,,https://kantonsrat-zh.talus.ch/de/politik/cdws/geschaefte.php?id=be679fa0c415492995338c704fa2583c,
«Klimanotstand»,62/2019,,Dringliches Postulat,25.02.2019,,,,https://kantonsrat-zh.talus.ch/de/politik/cdws/geschaefte.php?id=6ffb71a3fccb44d393a352efd2d62d31,
"Bedarfsgerechtes Angebot von Vorbereitungskursen für die Aufnahmeprüfungen an Maturitäts-, Handels- und Fachmittelschulen",68/2019,,Parlamentarische Initiative,25.02.2019,,,,https://kantonsrat-zh.talus.ch/de/politik/cdws/geschaefte.php?id=8123d4f30aa94044b9b6985e80331c71,
Vertiefte Untersuchung zum Beschaffungswesen der Hochschulen und Spitäler,59/2019,,,26.02.2019,,Aufsichtskommission Bildung und Gesundheit,,https://kantonsrat-zh.talus.ch/de/politik/cdws/geschaefte.php?id=e7e57f6716f146ba96eba7c8525ccd34,
Wahl Mitglied Handelsgericht,60/2019,,Wahl,26.02.2019,,Interfraktionelle Konferenz,,https://kantonsrat-zh.talus.ch/de/politik/cdws/geschaefte.php?id=2fff27b23f3345c7881656e0c55f337c,
Transparenz zu Klimarisiken durch die BVK,73/2019,,Anfrage,25.02.2019,Finanzdirektion,,,https://kantonsrat-zh.talus.ch/de/politik/cdws/geschaefte.php?id=710d53ec17cd46e9a25015334621d023,
Strategie zur Minimierung von Klimarisiken bei der BVK,74/2019,,Anfrage,25.02.2019,Finanzdirektion,,,https://kantonsrat-zh.talus.ch/de/politik/cdws/geschaefte.php?id=2772ff627f8948f8a96ae79016f8b6fa,
Der Kanton Zürich ruft den Klimanotstand aus - für «eusi Zuekunft»,63/2019,,Dringliches Postulat,25.02.2019,,,,https://kantonsrat-zh.talus.ch/de/politik/cdws/geschaefte.php?id=8ab1ec8360a74470b40e7813620b623b,
Aufhebung des Gesetzes über das Salzregal und über den Beitritt des Kantons Zürich zur lnterkantonalen Vereinbarung über den Salzverkauf in der Schweiz,67/2019,,Parlamentarische Initiative,25.02.2019,,,,https://kantonsrat-zh.talus.ch/de/politik/cdws/geschaefte.php?id=31e8e168e8574079ab1ec83d09b801a5,
Leistungsgruppe «Beteiligungsmanagement»,64/2019,,Postulat,25.02.2019,Staatskanzlei,,,https://kantonsrat-zh.talus.ch/de/politik/cdws/geschaefte.php?id=45b8e71df63347188caab780f3643162,
Umweltbericht: Was ist dem Regierungsrat «die Landschaft» wert?,14/2019,,Anfrage,14.01.2019,Baudirektion,,,https://kantonsrat-zh.talus.ch/de/politik/cdws/geschaefte.php?id=2bbc252d44dc457a86798624bef16818,
Ambulante und stationäre medizinische Versorgung im Knonauer Amt,15/2019,,Anfrage,14.01.2019,Gesundheitsdirektion,,,https://kantonsrat-zh.talus.ch/de/politik/cdws/geschaefte.php?id=ba298372e1b04616bdd3154a25f82e6e,
Bewegung trotz Sportdispens,16/2019,,Anfrage,14.01.2019,Bildungsdirektion,,,https://kantonsrat-zh.talus.ch/de/politik/cdws/geschaefte.php?id=a08f7bab8e86486082933b9efecaf6aa,
Umweltbericht: Lärmblitzer gegen dröhnende Motoren,17/2019,,Anfrage,14.01.2019,Baudirektion,,,https://kantonsrat-zh.talus.ch/de/politik/cdws/geschaefte.php?id=ce85162358a24ce78a676ba7d5b7b9e1,
Rettungsgasse jetzt,18/2019,,Anfrage,14.01.2019,Sicherheitsdirektion,,,https://kantonsrat-zh.talus.ch/de/politik/cdws/geschaefte.php?id=92c8328c963849ac87049c51bf130077,
Ist die Zwangsförderung der ambulanten Behandlung (Vorlage 5293) eine unzulässige Sparübung?,19/2019,,Anfrage,14.01.2019,Gesundheitsdirektion,,,https://kantonsrat-zh.talus.ch/de/politik/cdws/geschaefte.php?id=579ac34a2f0e4b869ed1ed76a5ab4803,
Unterstützung der Klimastreiks in Zürich,20/2019,,Anfrage,14.01.2019,Bildungsdirektion,,,https://kantonsrat-zh.talus.ch/de/politik/cdws/geschaefte.php?id=34092e14d6a641f39dbf0e0a57bf2ff9,
Verschiedene Problemstellungen bezüglich des Themas «Steuerbefreiung von gemeinnützigen Institutionen»,21/2019,,Anfrage,14.01.2019,Finanzdirektion,,,https://kantonsrat-zh.talus.ch/de/politik/cdws/geschaefte.php?id=94363186379f467abd40d0e55cf60a9f,
Mehr Start-ups im Technopark Winterthur,22/2019,,Anfrage,14.01.2019,Volkswirtschaftsdirektion,,,https://kantonsrat-zh.talus.ch/de/politik/cdws/geschaefte.php?id=60f580e780024a178d0020c10d487788,
Das Öffentlichkeitsprinzip stärken,23/2019,,Motion,21.01.2019,Direktion der Justiz und des Innern,,,https://kantonsrat-zh.talus.ch/de/politik/cdws/geschaefte.php?id=d1e2f88425524adf8d90e542c56a3072,
Ökologisch verantwortbare Gewächshäuser,24/2019,,Motion,21.01.2019,Baudirektion,,,https://kantonsrat-zh.talus.ch/de/politik/cdws/geschaefte.php?id=5a075707faf34f8aab1f7493d56ec7bd,
Sharing Economy ? lösen statt verbieten,25/2019,,Postulat,21.01.2019,Volkswirtschaftsdirektion,,,https://kantonsrat-zh.talus.ch/de/politik/cdws/geschaefte.php?id=c624c9a66e734538a7a157362adbcba6,
Innovative Tarifstrukturen bei Photovoltaik-Anlagen,26/2019,,Postulat,21.01.2019,Baudirektion,,,https://kantonsrat-zh.talus.ch/de/politik/cdws/geschaefte.php?id=b94510c62c434c608003a01fbc4eb107,
Entwicklung neuer Abschlüsse an Höheren Fachschulen,27/2019,,Anfrage,21.01.2019,,,,https://kantonsrat-zh.talus.ch/de/politik/cdws/geschaefte.php?id=a27f886bb4e8403f9cab5697da155d15,
Verwirrung um Nutzung freiwerdender Areale in der Stadt Zürich,28/2019,,Anfrage,21.01.2019,Baudirektion,,,https://kantonsrat-zh.talus.ch/de/politik/cdws/geschaefte.php?id=2b1870cc62c246e78c365a4a933702c8,
Situation des Prostitutionsgewerbes im Kanton Zürich,29/2019,,Anfrage,21.01.2019,,,,https://kantonsrat-zh.talus.ch/de/politik/cdws/geschaefte.php?id=453ce87d7b174ca991fdefb14c90a50d,
Schutz kritischer Internet-Infrastrukturen im Kanton Zürich,30/2019,,Anfrage,21.01.2019,,,,https://kantonsrat-zh.talus.ch/de/politik/cdws/geschaefte.php?id=3f680cb1742e4d1197efef6492031e2b,
Mobility Pricing,31/2019,,Anfrage,21.01.2019,,,,https://kantonsrat-zh.talus.ch/de/politik/cdws/geschaefte.php?id=dad1a5db71454f9fbdfc59e2c69cd63d,
Vermögensnachbesteuerung von landwirtschaftlichen Betrieben,53/2019,,Anfrage,04.02.2019,Finanzdirektion,,,https://kantonsrat-zh.talus.ch/de/politik/cdws/geschaefte.php?id=edcf380cfe8b4d28886b28905d410d8a,
Christbaumkulturen,54/2019,,Anfrage,04.02.2019,Baudirektion,,,https://kantonsrat-zh.talus.ch/de/politik/cdws/geschaefte.php?id=cdef0e0ccb864b2f8587e836088428e1,
Sicherung der Parteienvielfalt im Kantonsrat,55/2019,,Einzelinitiative,10.01.2019,,,,https://kantonsrat-zh.talus.ch/de/politik/cdws/geschaefte.php?id=7d8e355ccd7f4404959042619bf3dc82,
Abrechnung Kredit für die Ausrichtung eines Investitionsbeitrags an die Stiftung Zentralbibliothek Zürich für die Erstellung eines Erweiterungsbaus,,5515,Vorlage,09.01.2019,Bildungsdirektion,Kommission für Bildung und Kultur,,https://kantonsrat-zh.talus.ch/de/politik/cdws/geschaefte.php?id=4d7d136f1c7145d8a97caa90e008c28e,
Abrechnung Kredit für den Umbau der kleinen Reithalle und der Stallungen an der Sihl (Kulturinsel Gessnerallee) für die Schauspiel-Akademie Zürich,,5516,Vorlage,09.01.2019,Bildungsdirektion,Kommission für Bildung und Kultur,,https://kantonsrat-zh.talus.ch/de/politik/cdws/geschaefte.php?id=c3c037b0f92a458699be522154621e0a,
Keine Privatisierung von Wasserversorgungen und  Abwasserentsorgungen,56/2019,,Parlamentarische Initiative,10.02.2019,,,,https://kantonsrat-zh.talus.ch/de/politik/cdws/geschaefte.php?id=ef97a46710624945997fcb33882b99e6,
Gewährung eines Darlehens an die Lehrmittelverlag Zürich AG und der Beteiligung an der Aktienkapitalerhöhung,,5522,Vorlage,21.01.2019,Bildungsdirektion,Finanzkommission,,https://kantonsrat-zh.talus.ch/de/politik/cdws/geschaefte.php?id=30e2b816367f429cb393c0671b212a0e,
Abrechnung Kredit für den Umbau und die Erweiterung des Schulhauses Anton Graff der Berufsbildungsschule Winterthur,,5524,Vorlage,25.01.2019,Bildungsdirektion,Kommission für Bildung und Kultur,,https://kantonsrat-zh.talus.ch/de/politik/cdws/geschaefte.php?id=2534e9a5a3814cea9dc3fd2ae5c96dc6,
Vereinbarung betreffend Immobilien Universität Zürich,,5525,Vorlage,27.02.2019,Bildungsdirektion,Kommission für Planung und Bau,,https://kantonsrat-zh.talus.ch/de/politik/cdws/geschaefte.php?id=e03b2ae655f3479899b44977d9c92758,
Straftaten nach Art. 66a StGB müssen immer durch Gerichte beurteilt werden,88/2019,,Motion,11.03.2019,Direktion der Justiz und des Innern,,,https://kantonsrat-zh.talus.ch/de/politik/cdws/geschaefte.php?id=e469ca153e2d49719a87e2b5df431d29,
Verbesserungen auf der Stammstrecke Winterthur?Zürich bis zum Bau des Brüttener Tunnels,89/2019,,Postulat,11.03.2019,Volkswirtschaftsdirektion,,,https://kantonsrat-zh.talus.ch/de/politik/cdws/geschaefte.php?id=d2d0a1ffe7b64e70b11ae6ac5edc16be,
Digitalisierung Mittel- und Berufsfachschulen,90/2019,,Postulat,11.03.2019,Bildungsdirektion,,,https://kantonsrat-zh.talus.ch/de/politik/cdws/geschaefte.php?id=8bf4c182ea20411aba030c2db12f1a6c,
Vorbildfunktion des kantonalen Personals in Bezug auf Flugreisen,91/2019,,Postulat,11.03.2019,Finanzdirektion,,,https://kantonsrat-zh.talus.ch/de/politik/cdws/geschaefte.php?id=4da8ef59568945b1a5b35d181d8526fa,
Klimaschutz durch Moorschutz,92/2019,,Postulat,11.03.2019,Baudirektion,,,https://kantonsrat-zh.talus.ch/de/politik/cdws/geschaefte.php?id=b82f3b1e0e1f4d4abfd03155e739dddc,
Vergleichsdienst über familienfreundliche Arbeitgeber,93/2019,,Postulat,11.03.2019,Direktion der Justiz und des Innern,,,https://kantonsrat-zh.talus.ch/de/politik/cdws/geschaefte.php?id=df2e827b00e548e085964f043b6716ad,
Abzugsfähigkeit bei Staats- und Gemeindesteuern von energetischen Massnahmen bei Ersatzneubauten von Liegenschaften im Privatvermögen,94/2019,,Anfrage,11.03.2019,Finanzdirektion,,,https://kantonsrat-zh.talus.ch/de/politik/cdws/geschaefte.php?id=5ad2d7b69a1248898fe90dd468077618,
Fünf Jahre Demenzstrategie ? was sind die Ergebnisse?,95/2019,,Anfrage,11.03.2019,Gesundheitsdirektion,,,https://kantonsrat-zh.talus.ch/de/politik/cdws/geschaefte.php?id=b2311d02df7c47e98a545fbb6f146a94,
Spital Affoltern: Wie weiter nach der Abstimmung vom 19. Mai 2019?,96/2019,,Anfrage,11.03.2019,Gesundheitsdirektion,,,https://kantonsrat-zh.talus.ch/de/politik/cdws/geschaefte.php?id=7747391aa6a547cdad931846279f7d5b,
ZVV: Holzklasse in der S-Bahn während der Stosszeiten einführen?,97/2019,,Anfrage,11.03.2019,Volkswirtschaftsdirektion,,,https://kantonsrat-zh.talus.ch/de/politik/cdws/geschaefte.php?id=e72520cfb4e84dd6bce8afd8147090a8,
Ausrücken der Polizei wegen Asylbewerbern im Kanton Zürich,98/2019,,Anfrage,11.03.2019,Sicherheitsdirektion,,,https://kantonsrat-zh.talus.ch/de/politik/cdws/geschaefte.php?id=70849d01533d42e29b2dd2bd09544514,
Dringende Reparaturarbeiten am Berufsauftrag für die Volksschul-Lehrpersonen: Krankheitstage,99/2019,,Postulat,18.03.2019,Bildungsdirektion,,,https://kantonsrat-zh.talus.ch/de/politik/cdws/geschaefte.php?id=15104667a1e040f881fe70800083c0c9,
Fahr- und Reitverbote zwischen Obfelden und Ottenbach entlang der Reuss,100/2019,,Anfrage,18.03.2019,,,,https://kantonsrat-zh.talus.ch/de/politik/cdws/geschaefte.php?id=72c36350f6b947f3a0f52981747c769a,
Der ZKB-CEO und der Rahmenvertrag,101/2019,,Anfrage,18.03.2019,,,,https://kantonsrat-zh.talus.ch/de/politik/cdws/geschaefte.php?id=a0b36282b0634b318949fe97d761695e,
Sport als Promotionsfach auf der Sekundarstufe II an allen Zürcher Schulen,102/2019,,Anfrage,18.03.2019,,,,https://kantonsrat-zh.talus.ch/de/politik/cdws/geschaefte.php?id=0b8dd12addba4ad7a14e6b55c57abcf2,
Demokratie an Schulen,103/2019,,Einzelinitiative,22.02.2019,,,,https://kantonsrat-zh.talus.ch/de/politik/cdws/geschaefte.php?id=d450336e756b4426a7543b08e27e6c24,
Kantonaler Mindestlohn,104/2019,,Einzelinitiative,22.02.2019,,,,https://kantonsrat-zh.talus.ch/de/politik/cdws/geschaefte.php?id=62b18ee46a2a42718ac7b071764e219c,
Zugängliche Bildung,105/2019,,Einzelinitiative,22.02.2019,,,,https://kantonsrat-zh.talus.ch/de/politik/cdws/geschaefte.php?id=61ad67d34cc341ea88fa6ea8898cc01d,
"Mehr Sicherheit, Umweltschutz und Markt im Strassenverkehr durch Selbstkontrolle der Branche",,5526,Vorlage,13.03.2019,Sicherheitsdirektion,Kommission für Justiz und öffentliche Sicherheit,,https://kantonsrat-zh.talus.ch/de/politik/cdws/geschaefte.php?id=4ebbabbe320f42a6a73becb1919c9912,
Gewaltschutzgesetz (GSG),,5528,Vorlage,20.03.2019,Sicherheitsdirektion,Kommission für Justiz und öffentliche Sicherheit,,https://kantonsrat-zh.talus.ch/de/politik/cdws/geschaefte.php?id=0d4c9478a00c49308f69a3df0f25f867,
Aufhebung des Fonds zur Absicherung der Staatsgarantie für die Zürcher Kantonalbank (§ 6 Abs. 5 Kantonalbankgesetz),113/2019,,Motion,01.04.2019,Finanzdirektion,,,https://kantonsrat-zh.talus.ch/de/politik/cdws/geschaefte.php?id=d6d3f86812bb4f159bb6744d7433c656,
Nur Access-Controller oder doch richtiges Sicherheitspersonal?,114/2019,,Anfrage,01.04.2019,,,,https://kantonsrat-zh.talus.ch/de/politik/cdws/geschaefte.php?id=d0f611f42abc4854af8b88b7cba15f11,
Budgeterhöhung für das Jugendparlament um 150 %,115/2019,,Anfrage,01.04.2019,,,,https://kantonsrat-zh.talus.ch/de/politik/cdws/geschaefte.php?id=2d842159c3e04e49aece2bcfa4751587,
Bericht zu den Petitionen des Jugendparlaments,116/2019,,,26.02.2019,,Kommission für Bildung und Kultur,,https://kantonsrat-zh.talus.ch/de/politik/cdws/geschaefte.php?id=0291221465a24caf9cba6d193db38e05,
Festsetzung Budget für das Rechnungsjahr 2020,,5571,Vorlage,09.05.2019,Finanzdirektion,Finanzkommission,,https://kantonsrat-zh.talus.ch/de/politik/cdws/geschaefte.php?id=5321525b783443c6988cf0144daa5f18,
Tätigkeitsbericht der Finanzkontrolle des Kantons Zürich über das Jahr 2018,206/2019,,,09.05.2019,Finanzkontrolle,Finanzkommission,,https://kantonsrat-zh.talus.ch/de/politik/cdws/geschaefte.php?id=f0f125c153df469a8abc8232ed52b0d1,
Wahl der Mitglieder des Bildungsrates für die Amtsdauer 2019?2023,,5553,Vorlage,22.05.2019,Bildungsdirektion,Kommission für Bildung und Kultur,,https://kantonsrat-zh.talus.ch/de/politik/cdws/geschaefte.php?id=419facb09bc34505a7b2c8fd4e9d75ba,
Jahresbericht der Psychiatrischen Universitätsklinik Zürich und Bericht über die Umsetzung der Eigentümerstrategie für das Jahr 2018,,5552,Vorlage,22.05.2019,Gesundheitsdirektion,Aufsichtskommission Bildung und Gesundheit,,https://kantonsrat-zh.talus.ch/de/politik/cdws/geschaefte.php?id=19e4ae2cbc5f425eaece23b388938752,
Jahresbericht Kantonsspital Winterthur für das Jahr 2018,,5551,Vorlage,22.05.2019,Gesundheitsdirektion,Aufsichtskommission Bildung und Gesundheit,,https://kantonsrat-zh.talus.ch/de/politik/cdws/geschaefte.php?id=40d41ec6c59f440297604cf86b5c3489,
Jahresbericht Universitätsspital Zürich und Bericht über die Umsetzung der Eigentümerstrategie für das Jahr 2018,,5550,Vorlage,22.05.2019,Gesundheitsdirektion,Aufsichtskommission Bildung und Gesundheit,,https://kantonsrat-zh.talus.ch/de/politik/cdws/geschaefte.php?id=fc2fe8c62a584e03a8898e4dec7d31fc,
Änderung der Gemeindeverordnung (VGG),,5547,Vorlage,22.05.2019,Direktion der Justiz und des Innern,Kommission für Staat und Gemeinden,,https://kantonsrat-zh.talus.ch/de/politik/cdws/geschaefte.php?id=bb27d17cf079463a945b03e5285f2a02,
Unterstützung für LGBT-Jugendliche,173/2019,,Anfrage,03.06.2019,,,,https://kantonsrat-zh.talus.ch/de/politik/cdws/geschaefte.php?id=08a4fc8002bf4b26b5b4730acbee0262,
Arbeitslast der Beiständinnen und Beistände,174/2019,,Anfrage,03.06.2019,Bildungsdirektion,,,https://kantonsrat-zh.talus.ch/de/politik/cdws/geschaefte.php?id=14637cc1aead45a2ab244c1fed93fb80,
"Steuergesetz (StG), Änderung, Quellenbesteuerung des Erwerbseinkommens",,5549,Vorlage,22.05.2019,Finanzdirektion,Kommission für Wirtschaft und Abgaben,,https://kantonsrat-zh.talus.ch/de/politik/cdws/geschaefte.php?id=7b00de6537fe46ae8e9ee7fd525abe12,
Verbot von Rennen mit Motorfahrzeugen auf öffentlichen Strassen,175/2019,,Einzelinitiative,22.05.2019,,,,https://kantonsrat-zh.talus.ch/de/politik/cdws/geschaefte.php?id=b0b434c41afd454eb0f4ae31005819f8,
Für ein kommunales Stimm- und Wahlrecht für Ausländerinnen und Ausländer,176/2019,,Behördeninitiative,11.09.2019,,,,https://kantonsrat-zh.talus.ch/de/politik/cdws/geschaefte.php?id=f3fec4cf819c46b78b0c9721fa6aed80,
"Fristerstreckung für die Berichterstattung und Antragsstellung zur Motion KR-Nr. 177/2015 betreffend Richtplan Kapitel 4.7.2, Eintrag Flugplatz Dübendorf",,5554,Vorlage,05.06.2019,Baudirektion,Geschäftsprüfungskommission,,https://kantonsrat-zh.talus.ch/de/politik/cdws/geschaefte.php?id=1a371f6c05ef412eb7e79aabefdbfa88,
Elektronisches Büro im Steueramt,,5555,Vorlage,05.06.2019,Finanzdirektion,Kommission für Wirtschaft und Abgaben,,https://kantonsrat-zh.talus.ch/de/politik/cdws/geschaefte.php?id=e84cb75f443948fea27e3bd9eb3c21f7,
Flüsterbelag Hauptstrasse Steinmaur,197/2019,,Anfrage,17.06.2019,Baudirektion,,,https://kantonsrat-zh.talus.ch/de/politik/cdws/geschaefte.php?id=66613ffec4c246109f87ed00ed7afa50,
Integrationsagenda und Submissionen in der kantonalen Verwaltung,198/2019,,Anfrage,17.06.2019,Baudirektion,,,https://kantonsrat-zh.talus.ch/de/politik/cdws/geschaefte.php?id=b0d292e2de354faa9785012bc77690e5,
Transparenz zu den effektiven Kosten bei Kinder- und Jugendheimen,199/2019,,Anfrage,17.06.2019,Bildungsdirektion,,,https://kantonsrat-zh.talus.ch/de/politik/cdws/geschaefte.php?id=afed5f7450a24b09827201829c31046b,
Faire Rückliefertarife für Solarstrom,200/2019,,Anfrage,17.06.2019,Baudirektion,,,https://kantonsrat-zh.talus.ch/de/politik/cdws/geschaefte.php?id=baa320f2d7fa44c39871f3e596d5c52b,
Umsetzung des «Notfallschutzkonzepts bei einem KKW-Unfall in der Schweiz» im Kanton Zürich,201/2019,,Anfrage,17.06.2019,Sicherheitsdirektion,,,https://kantonsrat-zh.talus.ch/de/politik/cdws/geschaefte.php?id=258eeeeb95674fb7bfe79eb0e791d26f,
Foodwaste verringern I,185/2019,,Postulat,17.06.2019,Baudirektion,,Erledigt Kantonsrat ,https://kantonsrat-zh.talus.ch/de/politik/cdws/geschaefte.php?id=a6f151c151b34ee0893df35e12180307,
Foodwaste verringern II,186/2019,,Postulat,17.06.2019,Baudirektion,,,https://kantonsrat-zh.talus.ch/de/politik/cdws/geschaefte.php?id=ba7c32ce931e4bbe83de8edf3f26f6e1,
